[
  {
    "source": "bt-src",
    "target": "bd-code",
    "location": "description",
    "flags": [
      "cross_project"
    ],
    "sigil_kind": "inline_code"
  },
  {
    "source": "bt-src",
    "target": "bd-target",
    "location": "description",
    "flags": [
      "cross_project"
    ],
    "sigil_kind": "verb"
  }
]
